{
  "startYear": 1990,
  "endYear": 2025,
  "ecosystems": [
    {
      "name": "mangroves",
      "displayName": "Mangroves",
      "unit": "hectares",
      "data": [
        {
          "year": 1990,
          "value": 42528,
          "confidence": "medium"
        },
        {
          "year": 1991,
          "value": 41916,
          "confidence": "medium"
        },
        {
          "year": 1992,
          "value": 41682,
          "confidence": "medium"
        },
        {
          "year": 1993,
          "value": 40602,
          "confidence": "medium"
        },
        {
          "year": 1994,
          "value": 40287,
          "confidence": "medium"
        },
        {
          "year": 1995,
          "value": 39974,
          "confidence": "medium"
        },
        {
          "year": 1996,
          "value": 39081,
          "confidence": "medium"
        },
        {
          "year": 1997,
          "value": 38316,
          "confidence": "medium"
        },
        {
          "year": 1998,
          "value": 38595,
          "confidence": "medium"
        },
        {
          "year": 1999,
          "value": 37456,
          "confidence": "medium"
        },
        {
          "year": 2000,
          "value": 37600,
          "confidence": "high"
        },
        {
          "year": 2001,
          "value": 37653,
          "confidence": "high"
        },
        {
          "year": 2002,
          "value": 36011,
          "confidence": "high"
        },
        {
          "year": 2003,
          "value": 35858,
          "confidence": "high"
        },
        {
          "year": 2004,
          "value": 36079,
          "confidence": "high"
        },
        {
          "year": 2005,
          "value": 35278,
          "confidence": "high"
        },
        {
          "year": 2006,
          "value": 35533,
          "confidence": "high"
        },
        {
          "year": 2007,
          "value": 35849,
          "confidence": "high"
        },
        {
          "year": 2008,
          "value": 35921,
          "confidence": "high"
        },
        {
          "year": 2009,
          "value": 36191,
          "confidence": "high"
        },
        {
          "year": 2010,
          "value": 36664,
          "confidence": "high"
        },
        {
          "year": 2011,
          "value": 36815,
          "confidence": "high"
        },
        {
          "year": 2012,
          "value": 36129,
          "confidence": "high"
        },
        {
          "year": 2013,
          "value": 36920,
          "confidence": "high"
        },
        {
          "year": 2014,
          "value": 37128,
          "confidence": "high"
        },
        {
          "year": 2015,
          "value": 36718,
          "confidence": "high"
        },
        {
          "year": 2016,
          "value": 36731,
          "confidence": "high"
        },
        {
          "year": 2017,
          "value": 37000,
          "confidence": "high"
        },
        {
          "year": 2018,
          "value": 37004,
          "confidence": "high"
        },
        {
          "year": 2019,
          "value": 37503,
          "confidence": "high"
        },
        {
          "year": 2020,
          "value": 37443,
          "confidence": "high"
        },
        {
          "year": 2021,
          "value": 37761,
          "confidence": "high"
        },
        {
          "year": 2022,
          "value": 38273,
          "confidence": "high"
        },
        {
          "year": 2023,
          "value": 38325,
          "confidence": "high"
        },
        {
          "year": 2024,
          "value": 38522,
          "confidence": "high"
        },
        {
          "year": 2025,
          "value": 38634,
          "confidence": "high"
        }
      ]
    },
    {
      "name": "seagrass",
      "displayName": "Seagrass",
      "unit": "hectares",
      "data": [
        {
          "year": 1990,
          "value": 51465,
          "confidence": "low"
        },
        {
          "year": 1991,
          "value": 53701,
          "confidence": "low"
        },
        {
          "year": 1992,
          "value": 53598,
          "confidence": "low"
        },
        {
          "year": 1993,
          "value": 53393,
          "confidence": "low"
        },
        {
          "year": 1994,
          "value": 53312,
          "confidence": "low"
        },
        {
          "year": 1995,
          "value": 52683,
          "confidence": "low"
        },
        {
          "year": 1996,
          "value": 50525,
          "confidence": "low"
        },
        {
          "year": 1997,
          "value": 49626,
          "confidence": "low"
        },
        {
          "year": 1998,
          "value": 48587,
          "confidence": "low"
        },
        {
          "year": 1999,
          "value": 47885,
          "confidence": "low"
        },
        {
          "year": 2000,
          "value": 47963,
          "confidence": "medium"
        },
        {
          "year": 2001,
          "value": 48496,
          "confidence": "medium"
        },
        {
          "year": 2002,
          "value": 49367,
          "confidence": "medium"
        },
        {
          "year": 2003,
          "value": 50573,
          "confidence": "medium"
        },
        {
          "year": 2004,
          "value": 50490,
          "confidence": "medium"
        },
        {
          "year": 2005,
          "value": 51877,
          "confidence": "medium"
        },
        {
          "year": 2006,
          "value": 51524,
          "confidence": "medium"
        },
        {
          "year": 2007,
          "value": 50539,
          "confidence": "medium"
        },
        {
          "year": 2008,
          "value": 49227,
          "confidence": "medium"
        },
        {
          "year": 2009,
          "value": 47774,
          "confidence": "medium"
        },
        {
          "year": 2010,
          "value": 46941,
          "confidence": "high"
        },
        {
          "year": 2011,
          "value": 46147,
          "confidence": "high"
        },
        {
          "year": 2012,
          "value": 45111,
          "confidence": "high"
        },
        {
          "year": 2013,
          "value": 45941,
          "confidence": "high"
        },
        {
          "year": 2014,
          "value": 46315,
          "confidence": "high"
        },
        {
          "year": 2015,
          "value": 46731,
          "confidence": "high"
        },
        {
          "year": 2016,
          "value": 47277,
          "confidence": "high"
        },
        {
          "year": 2017,
          "value": 48461,
          "confidence": "high"
        },
        {
          "year": 2018,
          "value": 48935,
          "confidence": "high"
        },
        {
          "year": 2019,
          "value": 48153,
          "confidence": "high"
        },
        {
          "year": 2020,
          "value": 48097,
          "confidence": "high"
        },
        {
          "year": 2021,
          "value": 46949,
          "confidence": "high"
        },
        {
          "year": 2022,
          "value": 44861,
          "confidence": "high"
        },
        {
          "year": 2023,
          "value": 44052,
          "confidence": "high"
        },
        {
          "year": 2024,
          "value": 43213,
          "confidence": "high"
        },
        {
          "year": 2025,
          "value": 42488,
          "confidence": "high"
        }
      ]
    },
    {
      "name": "coralReef",
      "displayName": "Coral Reef",
      "unit": "hectares",
      "data": [
        {
          "year": 1990,
          "value": 152954,
          "confidence": "high"
        },
        {
          "year": 1991,
          "value": 152705,
          "confidence": "high"
        },
        {
          "year": 1992,
          "value": 151199,
          "confidence": "high"
        },
        {
          "year": 1993,
          "value": 152625,
          "confidence": "high"
        },
        {
          "year": 1994,
          "value": 151343,
          "confidence": "high"
        },
        {
          "year": 1995,
          "value": 152799,
          "confidence": "high"
        },
        {
          "year": 1996,
          "value": 151707,
          "confidence": "high"
        },
        {
          "year": 1997,
          "value": 152423,
          "confidence": "high"
        },
        {
          "year": 1998,
          "value": 151010,
          "confidence": "high"
        },
        {
          "year": 1999,
          "value": 151261,
          "confidence": "high"
        },
        {
          "year": 2000,
          "value": 151887,
          "confidence": "high"
        },
        {
          "year": 2001,
          "value": 151029,
          "confidence": "high"
        },
        {
          "year": 2002,
          "value": 152993,
          "confidence": "high"
        },
        {
          "year": 2003,
          "value": 151705,
          "confidence": "high"
        },
        {
          "year": 2004,
          "value": 151725,
          "confidence": "high"
        },
        {
          "year": 2005,
          "value": 152457,
          "confidence": "high"
        },
        {
          "year": 2006,
          "value": 152050,
          "confidence": "high"
        },
        {
          "year": 2007,
          "value": 152374,
          "confidence": "high"
        },
        {
          "year": 2008,
          "value": 151795,
          "confidence": "high"
        },
        {
          "year": 2009,
          "value": 151254,
          "confidence": "high"
        },
        {
          "year": 2010,
          "value": 152425,
          "confidence": "high"
        },
        {
          "year": 2011,